{
  "$defs": {
    "Evidence": {
      "additionalProperties": false,
      "description": "One item in a signal's evidence chain.\n\n``kind`` is the evidence family (e.g. \"wallet_trade\", \"cluster_agree\",\n\"news_headline\"); ``ref`` is a stable identifier the dashboard can\ndereference (wallet address + tx hash, article URL, etc.). ``weight``\nis the signal's own attribution \u2014 how much this evidence contributes\nto the confidence score.",
      "properties": {
        "detail": {
          "additionalProperties": {
            "type": "string"
          },
          "title": "Detail",
          "type": "object"
        },
        "kind": {
          "minLength": 1,
          "title": "Kind",
          "type": "string"
        },
        "ref": {
          "minLength": 1,
          "title": "Ref",
          "type": "string"
        },
        "schema_version": {
          "default": "1.0.0",
          "description": "Schema version of this payload; consumers reject on mismatch.",
          "pattern": "^1\\.0\\.0$",
          "title": "Schema Version",
          "type": "string"
        },
        "weight": {
          "maximum": 1,
          "minimum": 0,
          "title": "Weight",
          "type": "number"
        }
      },
      "required": [
        "kind",
        "ref",
        "weight"
      ],
      "title": "Evidence",
      "type": "object"
    },
    "OutcomeInstrument": {
      "additionalProperties": false,
      "description": "A tradable outcome token on a venue.\n\nUsed everywhere the executor / signal side needs to identify a\nspecific YES/NO share. ``condition_id`` selects the market;\n``outcome_token_id`` selects the side of it.",
      "properties": {
        "condition_id": {
          "minLength": 1,
          "title": "Condition Id",
          "type": "string"
        },
        "outcome_token_id": {
          "minLength": 1,
          "title": "Outcome Token Id",
          "type": "string"
        },
        "schema_version": {
          "default": "1.0.0",
          "description": "Schema version of this payload; consumers reject on mismatch.",
          "pattern": "^1\\.0\\.0$",
          "title": "Schema Version",
          "type": "string"
        },
        "venue": {
          "const": "polymarket",
          "title": "Venue",
          "type": "string"
        }
      },
      "required": [
        "venue",
        "condition_id",
        "outcome_token_id"
      ],
      "title": "OutcomeInstrument",
      "type": "object"
    }
  },
  "$id": "https://nbe-theta.local/schemas/signal-envelope.schema.json",
  "$schema": "https://json-schema.org/draft/2020-12/schema",
  "additionalProperties": false,
  "description": "The wire type a signal generator emits into the signal outbox.\n\n``expires_at`` is the freshness deadline (the executor rejects the\nintent if it stales). ``confidence`` is a probability in [0, 1] on\nthe signal's own model scale \u2014 NOT a calibrated market probability.\n\nNote: ``maximum_price`` and ``maximum_loss_usd`` are DECLARED by the\nsignal but ENFORCED by the executor's own risk snapshot; sizes here\nare advisory, not authoritative.",
  "properties": {
    "confidence": {
      "maximum": 1,
      "minimum": 0,
      "title": "Confidence",
      "type": "number"
    },
    "created_at": {
      "format": "date-time",
      "title": "Created At",
      "type": "string"
    },
    "direction": {
      "enum": [
        "BUY",
        "SELL"
      ],
      "title": "Direction",
      "type": "string"
    },
    "evidence": {
      "items": {
        "$ref": "#/$defs/Evidence"
      },
      "title": "Evidence",
      "type": "array"
    },
    "expires_at": {
      "format": "date-time",
      "title": "Expires At",
      "type": "string"
    },
    "market": {
      "$ref": "#/$defs/OutcomeInstrument"
    },
    "maximum_loss_usd": {
      "format": "decimal",
      "pattern": "^(?!0+(\\.0+)?$)(0|[1-9]\\d*)(\\.\\d+)?$",
      "title": "Maximum Loss Usd",
      "type": "string"
    },
    "maximum_price": {
      "format": "decimal",
      "pattern": "^(?!0(\\.0+)?$)(0(\\.\\d+)?|1(\\.0+)?)$",
      "title": "Maximum Price",
      "type": "string"
    },
    "model_version": {
      "minLength": 1,
      "title": "Model Version",
      "type": "string"
    },
    "schema_version": {
      "default": "1.0.0",
      "description": "Schema version of this payload; consumers reject on mismatch.",
      "pattern": "^1\\.0\\.0$",
      "title": "Schema Version",
      "type": "string"
    },
    "signal_id": {
      "format": "uuid",
      "title": "Signal Id",
      "type": "string"
    },
    "strategy_type": {
      "enum": [
        "wallet_follow",
        "wallet_cluster_confirmation",
        "fast_information_alert",
        "news_probability",
        "market_microstructure",
        "future_cross_venue_arbitrage"
      ],
      "title": "Strategy Type",
      "type": "string"
    }
  },
  "required": [
    "signal_id",
    "strategy_type",
    "market",
    "direction",
    "maximum_price",
    "maximum_loss_usd",
    "expires_at",
    "confidence",
    "model_version",
    "created_at"
  ],
  "title": "SignalEnvelope",
  "type": "object"
}
