{
  "schema_version": "1.0.0",
  "signal_id": "b5c1d0d2-6e6f-4a1b-9c3d-a1b2c3d4e5f6",
  "strategy_type": "wallet_follow",
  "market": {
    "schema_version": "1.0.0",
    "venue": "polymarket",
    "condition_id": "0x0000000000000000000000000000000000000000000000000000000000000001",
    "outcome_token_id": "1"
  },
  "direction": "BUY",
  "maximum_price": "0.43",
  "maximum_loss_usd": "250.00",
  "expires_at": "2026-07-18T05:30:00Z",
  "confidence": 0.78,
  "evidence": [
    {
      "schema_version": "1.0.0",
      "kind": "wallet_trade",
      "ref": "0xabc123:0xdead...cafe",
      "weight": 0.6,
      "detail": {}
    }
  ],
  "model_version": "wallet-follow-0.3.0",
  "created_at": "2026-07-18T04:30:00Z"
}
